{
  "schema_version": "2.0",
  "name": "cpu_hotspot_inventory",
  "target": {
    "pid": 1234,
    "process_start_time": 987654
  },
  "sample_event": "cpu_clock",
  "frequency_hz": 99,
  "duration_ms": 1000,
  "timeout_ms": 30000,
  "max_samples": 10000,
  "max_groups": 256,
  "stack_depth": 64,
  "max_threads": 1024
}
